,text,pre_annotation,xavi,miriam,mireia,agreement
a_38,Quiero mucho a mis amigos y a veces pienso que ellos a mi no tanto,['no distorsión'],['distorsión'],['no distorsión'],['distorsión'],2
d_184,Durante la presentación que he hecho creo que se han aburrido porque soy un pesado.,['distorsión'],['distorsión'],['distorsión'],['distorsión'],4
a_170,"Esta persona me da mala espina, pero no  tengo motivos para pensar que quiere hacerme daño",['no distorsión'],['no distorsión'],['no distorsión'],['distorsión'],3
d_181,María se está riendo; seguro que es de mí.,['distorsión'],['distorsión'],['distorsión'],['distorsión'],4
d_115,Me quedaré en blanco en el examen,['distorsión'],['distorsión'],['distorsión'],['distorsión'],4
t_103,"si no pongo suficiente sal, la comida me saldrá insulsa",['no distorsión'],['no distorsión'],['distorsión'],['no distorsión'],3
t_179,Si te sientes feliz te fijarás más en  las cosas buenas que te pasan,['no distorsión'],['no distorsión'],['distorsión'],['no distorsión'],3
a_157,"Si mi pareja me quiere, no tengo porque dudar de sus sentimientos por una discusión.",['no distorsión'],['no distorsión'],['no distorsión'],['no distorsión'],4
a_145,Quizás tu jefe te ha citado por otro motivo. ¿Podría ser?,['no distorsión'],['no distorsión'],['no distorsión'],['no distorsión'],4
a_2,Mi hermano algunas veces no cumple con su palabra,['no distorsión'],['no distorsión'],['no distorsión'],['no distorsión'],4
t_130,La reparación será bastante cara,['no distorsión'],['no distorsión'],['distorsión'],['no distorsión'],3
a_52,Estaria bien intentar controlar más la cantidad que como,['no distorsión'],['no distorsión'],['no distorsión'],['no distorsión'],4
a_127,"Lo que me está pasando es duro, no es agradable, pero lo puedo soportar",['no distorsión'],['no distorsión'],['no distorsión'],['no distorsión'],4
a_180,"Si me siento mal puede ser por muchos motivos, que alguien me haya tratado de manera injusta es uno de ellos, podría pensar en las distintas alternativas",['no distorsión'],['no distorsión'],['no distorsión'],['no distorsión'],4
d_43,debería limpiar más mi casa porque siempre está muy sucia,['distorsión'],['no distorsión'],['distorsión'],['no distorsión'],2
a_99,"Todos a veces ganamos y otras perdemos, pero lo importante es intentar las cosas que queremos hacer",['no distorsión'],['no distorsión'],['no distorsión'],['no distorsión'],4
a_109,"Si te has preparado bien para el examen no tiene porque ir mal, no podemos saber que passará antes de hacerlo",['no distorsión'],['no distorsión'],['no distorsión'],['no distorsión'],4
d_79,"Las personas son hipócritas, confías en ellas y te mienten",['distorsión'],['distorsión'],['distorsión'],['distorsión'],4
d_52,tengo que comer menos,['distorsión'],['distorsión'],['distorsión'],['no distorsión'],3
d_71,mi amiga es idiota,['distorsión'],['distorsión'],['distorsión'],['distorsión'],4
t_67,en el deporte soy un poco torpe,['no distorsión'],['no distorsión'],['no distorsión'],['no distorsión'],4
a_121,"Ha ido mal, pero podemos solucinarlo",['no distorsión'],['no distorsión'],['no distorsión'],['no distorsión'],4
t_94,Si no  le permito a mi hijo que se enfade no aprenderá que es una emoción como cualquier otra,['no distorsión'],['no distorsión'],['no distorsión'],['no distorsión'],4
a_97,Las cosas que hacemos con empeño y dedicación estan bien aunque no las veamos perfectas,['no distorsión'],['no distorsión'],['no distorsión'],['no distorsión'],4
t_34,Piensa mal y acertarás ,['no distorsión'],['distorsión'],['distorsión'],['distorsión'],3
t_184,"Estaban criticando a alguien esta mañana en el trabajo, seguro que no soy yo",['no distorsión'],['distorsión'],['distorsión'],['distorsión'],3
d_20,mi pareja siempre hace lo mismo,['distorsión'],['distorsión'],['distorsión'],['distorsión'],4
d_169,"Si te da miedo, es porque debe haber algo peligroso en ello.",['distorsión'],['distorsión'],['distorsión'],['distorsión'],4
d_56,tengo que ser el mejor si no me despedirán,['distorsión'],['distorsión'],['distorsión'],['distorsión'],4
a_178,"Que sienta ansiedad al estar entre tantas personas es independiente del peligro real que exista, es solo mi emoción",['no distorsión'],['no distorsión'],['no distorsión'],['no distorsión'],4
d_19,siempre me ignora,['distorsión'],['distorsión'],['distorsión'],['distorsión'],4
d_133,"Me he equivocado en el nombre de un informe, mi jefa me va a matar, nunca más confiará en mí, esto ya no puede ser peor",['distorsión'],['distorsión'],['distorsión'],['distorsión'],4
d_86,No aguanto más la situación con mi pareja. O elige a su familia o me elige a mí,['distorsión'],['distorsión'],['distorsión'],['distorsión'],4
d_80,"Soy muy gafe, estropeo todo lo que toco.",['distorsión'],['distorsión'],['distorsión'],['distorsión'],4
d_167,Mi abuelo murió hace un mes y mi madre está triste desde entonces. Creo que ella se va a morir también.,['distorsión'],['distorsión'],['distorsión'],['distorsión'],4
d_145,Mi jefe me ha pedido que llegue cinco minutos antes. No está contento con mi trabajo.,['distorsión'],['distorsión'],['distorsión'],['distorsión'],4
a_23,No puedo saber lo que piensa el ascensorista de mi si no le pregunto,['no distorsión'],['no distorsión'],['no distorsión'],['no distorsión'],4
a_41,Me iria bien ponerme a estudiar ahora,['no distorsión'],['no distorsión'],['no distorsión'],['no distorsión'],4
t_19,Todos podemos sentirnos mal,['no distorsión'],['no distorsión'],['no distorsión'],['no distorsión'],4
t_190,"Me estaban mirando los pantalones, seguro que es porque quiere unos iguales",['no distorsión'],['distorsión'],['distorsión'],['distorsión'],3
a_40,No tengo nada que justifique mi pensameinto de que me odia si nunca me ha dicho nada malo,['no distorsión'],['no distorsión'],['no distorsión'],['no distorsión'],4
d_83,"O soy perfecto, o soy un desastre",['distorsión'],['distorsión'],['distorsión'],['distorsión'],4
t_148,No tengo comida en casa por lo que tendré que pedirla a domicilio,['no distorsión'],['no distorsión'],['distorsión'],['no distorsión'],3
d_104,"Estoy segura de que, aunque salga con amigos, me sentiré mal.",['distorsión'],['distorsión'],['distorsión'],['distorsión'],4
d_165,"Me siento solo, nunca tendré amigos de verdad",['distorsión'],['distorsión'],['distorsión'],['distorsión'],4
d_101,estoy convencida de que me sentiré mal.,['distorsión'],['distorsión'],['distorsión'],['distorsión'],4
d_155,La crítica que hicieron sobre mi exposición me fastidió el día entero ,['distorsión'],['no distorsión'],['distorsión'],['no distorsión'],2
a_160,"Hay muchos motivos por los que me pudo substituir a media parte, no tiene porque estar relacionado con mi rendimiento",['no distorsión'],['no distorsión'],['no distorsión'],['no distorsión'],4
t_155,"Hemos llegado al restaurante y estaba cerrado, se no ha fastidado la hora de comer",['no distorsión'],['distorsión'],['distorsión'],['distorsión'],3
a_108,"No puedes saber que pasará en la fiesta antes de ir, puedes provar a ir y ver como va",['no distorsión'],['no distorsión'],['no distorsión'],['no distorsión'],4
d_112,Seguro que no apruebo la evaluación,['distorsión'],['distorsión'],['distorsión'],['distorsión'],4
a_59,Si me organizo el teimpo no me pondré tant nervioso y todo saldrá bien,['no distorsión'],['no distorsión'],['distorsión'],['distorsión'],2
t_21,estoy seguro de mis capacidades,['no distorsión'],['no distorsión'],['distorsión'],['distorsión'],2
t_185,Nada de lo que ha sucedido es por mi culpa,['no distorsión'],['distorsión'],['distorsión'],['distorsión'],3
a_34,Como me ayuda supongo que soy una persona importante para ella,['no distorsión'],['no distorsión'],['no distorsión'],['distorsión'],3
a_172,"Siento que no vale la pena esforzarme, pero probablemente sea porque estoy frustrado, lo seguiré intentando",['no distorsión'],['no distorsión'],['no distorsión'],['no distorsión'],4
t_143,"Pude haber disfrutado de la excursión y, de hecho, lo hice ",['no distorsión'],['no distorsión'],['no distorsión'],['no distorsión'],4
t_136,Mi mujer será la directora de su oficina,['no distorsión'],['no distorsión'],['no distorsión'],['no distorsión'],4
d_137,"Mi hijo no me ha llamado para decirme que ha llegado. Seguro que les ha pasado algo malo, algo terrible, seguro que han tenido un accidente",['distorsión'],['distorsión'],['distorsión'],['distorsión'],4
t_75,"Soy la pequeña de mi familia, tengo dos hermanos mayores",['no distorsión'],['no distorsión'],['no distorsión'],['no distorsión'],4
d_148,Mis padres se han separado. Seguro que ha sido por mi culpa.,['distorsión'],['distorsión'],['distorsión'],['distorsión'],4
d_41,Tengo que estudiar como sea,['distorsión'],['no distorsión'],['distorsión'],['no distorsión'],2
d_134,"Que no me responda al mensaje sería lo peor del mundo, lo peor que me podría pasar",['distorsión'],['distorsión'],['distorsión'],['distorsión'],4
t_137,Me han sucedido cosas desagradables,['no distorsión'],['no distorsión'],['no distorsión'],['no distorsión'],4
t_107,"si digo como me siento, me sentiré vulnerable ",['no distorsión'],['distorsión'],['distorsión'],['no distorsión'],2
a_31,"Me parece que a mis amigos les gustaria que les dedicara más tiempo, hablaré con ellos y les explicaré lo que me pasa.",['no distorsión'],['no distorsión'],['no distorsión'],['no distorsión'],4
d_40,"nunca me ha dicho nada malo, pero sé que me odia",['distorsión'],['distorsión'],['distorsión'],['distorsión'],4
d_18,todo lo hago mal,['distorsión'],['distorsión'],['distorsión'],['distorsión'],4
a_182,"Que tu jefe te esté informando de una nueva norma que está afectando a todos los residentes y no solo a ti, no es ninguna razon por la que pensar que no se fia de tí.",['no distorsión'],['no distorsión'],['no distorsión'],['no distorsión'],4
a_73,"Me he vuelto a equivocar, igual podria intentar estar más atento",['no distorsión'],['no distorsión'],['no distorsión'],['no distorsión'],4
a_57,En el trabajo esta bien que haga lo que esté en mi mano para que las cosas se terminen a tiempo,['no distorsión'],['no distorsión'],['no distorsión'],['no distorsión'],4
a_110,"No podemos saber si será así, de todas formas es normal no hacerlo todo bien el primer dia de trabajo",['no distorsión'],['no distorsión'],['no distorsión'],['no distorsión'],4
d_3,Todo lo hago igual,['distorsión'],['distorsión'],['distorsión'],['distorsión'],4
d_1,Todo me sale mal… ,['distorsión'],['distorsión'],['distorsión'],['distorsión'],4
d_132,"Me noto el corazón muy acelerado, me dará un ataque de pánico y será horroroso",['distorsión'],['distorsión'],['distorsión'],['distorsión'],4
t_30,Estoy seguro en este lugar al que he ido a vivir. ,['no distorsión'],['no distorsión'],['no distorsión'],['no distorsión'],4
t_161,Siento pavor al subirme a un avión,['no distorsión'],['no distorsión'],['no distorsión'],['no distorsión'],4
t_50,debo ir al supermercado porque tengo la nevera vacía,['no distorsión'],['no distorsión'],['distorsión'],['no distorsión'],3
d_91,si no dejo de comer seguiré estando gordo,['distorsión'],['distorsión'],['distorsión'],['no distorsión'],3
d_10,nadie me echa cuenta,['distorsión'],['distorsión'],['distorsión'],['distorsión'],4
a_74,Mi jefe y yo tenemos formas diferentes de ver las cosas y no nos entendemos,['no distorsión'],['no distorsión'],['no distorsión'],['no distorsión'],4
a_9,Algunas personas no estan tant pendientes de mi como me gustaria,['no distorsión'],['no distorsión'],['no distorsión'],['no distorsión'],4
a_193,Que tu pareja este disgustada puede ser por muchos motivos,['no distorsión'],['no distorsión'],['no distorsión'],['no distorsión'],4
a_146,Que tu madre juegue más con tu hermana pequeña no necesariamente quiere decir que le quiera más a ella que a ti,['no distorsión'],['no distorsión'],['no distorsión'],['no distorsión'],4
d_108,No iré a la fiesta porque seguro que hago el ridículo,['distorsión'],['distorsión'],['distorsión'],['distorsión'],4
a_88,Necesito un descanso para poder seguir rindiendo y que las cosas salgan como espero,['no distorsión'],['no distorsión'],['no distorsión'],['no distorsión'],4
t_13,Siempre me ha gustado bailar,['no distorsión'],['no distorsión'],['no distorsión'],['no distorsión'],4
a_166,"Ahora mismo siento que no puedo con esto, pero puede que más adelante lo vea de otro modo",['no distorsión'],['no distorsión'],['no distorsión'],['no distorsión'],4
t_170,Me siento mal por haberle dicho la verdad a mi amiga,['no distorsión'],['no distorsión'],['no distorsión'],['no distorsión'],4
a_53,Podria fijarme más en lo que como e intentar adelgazar,['no distorsión'],['no distorsión'],['no distorsión'],['no distorsión'],4
t_66,Es completamente estúpido pensar que puedes ir a la luna andando,['no distorsión'],['no distorsión'],['no distorsión'],['no distorsión'],4
a_42,me gustaria que la gente fuese más amable conmigo,['no distorsión'],['no distorsión'],['no distorsión'],['no distorsión'],4
t_92,Si no le hago la comida a mi pareja no conseguirá su meta de estar más delgada porque no se sabe cocinar,['no distorsión'],['distorsión'],['distorsión'],['distorsión'],3
a_152,No sacar todo sobresalientes no me convierte en un desastre. ,['no distorsión'],['no distorsión'],['no distorsión'],['distorsión'],3
t_186,"Mi compañero de trabajo me ha mirado esta mañana, seguro que le gusto",['no distorsión'],['distorsión'],['distorsión'],['distorsión'],3
d_174,"Siento que no soy capaz, por lo tanto no debo serlo",['distorsión'],['distorsión'],['distorsión'],['distorsión'],4
a_141,Perder el paraguas es un hecho puntual que no afecta a como soy yo,['no distorsión'],['no distorsión'],['no distorsión'],['no distorsión'],4
t_187,"El proyecto no ha ido bien, no es mi culpa",['no distorsión'],['no distorsión'],['no distorsión'],['no distorsión'],4
a_179,"Es fácil sentirse un perdedor cuando las cosas van mal, quizás podría fijarme en las pequeñas cosas buenas de mi vida",['no distorsión'],['no distorsión'],['no distorsión'],['no distorsión'],4
a_113,"ya superé otras entrevistas antes, puedo superar esta también ",['no distorsión'],['no distorsión'],['no distorsión'],['no distorsión'],4
a_15,"Me cuesta hacer mi tarea, tendré que centrarme en ella",['no distorsión'],['no distorsión'],['no distorsión'],['no distorsión'],4
t_91,Si no hubiera ido a ver esa peli no me lo hubiera pasado tan bien,['no distorsión'],['no distorsión'],['no distorsión'],['no distorsión'],4
d_12,siempre tengo problemas,['distorsión'],['distorsión'],['distorsión'],['distorsión'],4
d_113,no superaré la entrevista,['distorsión'],['distorsión'],['distorsión'],['distorsión'],4
t_6,Nunca he ido a italia,['no distorsión'],['no distorsión'],['no distorsión'],['distorsión'],3
d_17,nadie me tiene en cuenta,['distorsión'],['distorsión'],['distorsión'],['distorsión'],4
d_114,Seguro que hará mal tiempo en vacaciones,['distorsión'],['distorsión'],['distorsión'],['distorsión'],4
a_22,"Creo que mi padre piensa que soy inutil, pero realmente no tengo hechos que me lo indiquen",['no distorsión'],['no distorsión'],['no distorsión'],['no distorsión'],4
a_29,Me trata bien aunque a veces me hace pensar que me odia,['no distorsión'],['no distorsión'],['no distorsión'],['distorsión'],3
a_156,Estando de vacaciones es probable que hubiesen momentos del día de los que sí disfrutase,['no distorsión'],['no distorsión'],['no distorsión'],['no distorsión'],4
a_167,"Como mi abuelo murió hace un mes y mi madre está triste, siento que mi madre también podria morir, pero probablemente sea por como me ha afectado a mi esta situación",['no distorsión'],['no distorsión'],['no distorsión'],['no distorsión'],4
a_111,"A veces algunas cosas salen mal, pero esto no significa que sieempre todo vaya mal",['no distorsión'],['no distorsión'],['no distorsión'],['no distorsión'],4
t_49,debo coger el tren para ir a ver a mi tia,['no distorsión'],['no distorsión'],['no distorsión'],['no distorsión'],4
a_72,"Le he hablado mal a mi madre, he dicho cosas que no queria y ahora me siento mal conmigo mismo ",['no distorsión'],['no distorsión'],['no distorsión'],['no distorsión'],4
t_69,soy pésimo en el ajedrez,['no distorsión'],['no distorsión'],['distorsión'],['distorsión'],2
t_15,No me gusta nada la col,['no distorsión'],['no distorsión'],['no distorsión'],['no distorsión'],4
d_11,nadie me valora,['distorsión'],['distorsión'],['distorsión'],['distorsión'],4
t_154,Me dice que me quiere y a veces me abraza. Estoy super contento con ella,['no distorsión'],['no distorsión'],['no distorsión'],['no distorsión'],4
t_39,Estoy seguro de mis habilidades artísticas,['no distorsión'],['no distorsión'],['no distorsión'],['no distorsión'],4
a_65,Mi tio no me cae demasiado bien,['no distorsión'],['no distorsión'],['no distorsión'],['no distorsión'],4
a_143,Quizás hubieron otros aspectos que sí te hicieron disfrutar de la excursión.,['no distorsión'],['no distorsión'],['no distorsión'],['no distorsión'],4
a_69,Puedo hacer cosas mal pero eso no me define como persona,['no distorsión'],['no distorsión'],['no distorsión'],['no distorsión'],4
a_67,"cuando las cosas no salen como espero es dificil pensar bien de mi, pero en realidad muchas veces acierto",['no distorsión'],['no distorsión'],['no distorsión'],['no distorsión'],4
d_39,"siempre me dice que me quiere, pero sé que no es verdad",['distorsión'],['distorsión'],['distorsión'],['distorsión'],4
d_13,jamás tendré fuerzas para conseguir lo que quiero,['distorsión'],['distorsión'],['distorsión'],['distorsión'],4
t_60,Debo darle de comer a mis perros,['no distorsión'],['no distorsión'],['no distorsión'],['no distorsión'],4
a_75,No me gusta como responde mi pareja cuando discutimos,['no distorsión'],['no distorsión'],['no distorsión'],['no distorsión'],4
a_106,"Estar bien no predice que vaya a pasar algo malo, es mejor disfrutar de estar bien",['no distorsión'],['no distorsión'],['no distorsión'],['no distorsión'],4
a_158,Quizás llegó tarde por otro motivo,['no distorsión'],['no distorsión'],['no distorsión'],['no distorsión'],4
a_5,Algunas personas no me queiren,['no distorsión'],['no distorsión'],['no distorsión'],['no distorsión'],4
t_17,Nada con mucho estilo,['no distorsión'],['no distorsión'],['no distorsión'],['no distorsión'],4
a_78,"Les expliqué mi problema y esperaba otra cosa de ellos, me han fallado esta vez.",['no distorsión'],['distorsión'],['no distorsión'],['no distorsión'],3
t_145,"Mi jefe me ha felicitado, eso es que está contento con mi trabajo ",['no distorsión'],['no distorsión'],['no distorsión'],['no distorsión'],4
d_76,he discutido con mi pareja es completamente estúpido,['distorsión'],['distorsión'],['distorsión'],['distorsión'],4
t_93,O llego a mi trabajo a las 8 que es la hora perfecta o más tarde no consigo aparcar el coche,['no distorsión'],['no distorsión'],['distorsión'],['distorsión'],2
t_98,Si alguien del grupo no sabe jugar  o le enseñamos o es facil que pierda ,['no distorsión'],['no distorsión'],['no distorsión'],['no distorsión'],4
t_113,me irá mal algunas veces,['no distorsión'],['no distorsión'],['no distorsión'],['no distorsión'],4
d_78,es rematadamente tonto,['distorsión'],['distorsión'],['distorsión'],['distorsión'],4
t_42,tengo que ir un momento al baño,['no distorsión'],['no distorsión'],['no distorsión'],['no distorsión'],4
d_36,"nunca me ha dicho nada, pero sé que piensa mal de mí",['distorsión'],['distorsión'],['distorsión'],['distorsión'],4
d_111,Estoy convencida de que todo irá mal,['distorsión'],['distorsión'],['distorsión'],['distorsión'],4
a_147,No tengo pruebas suficientes acerca de lo que va a ocurrir con mis padres en el futuro,['no distorsión'],['no distorsión'],['no distorsión'],['no distorsión'],4
d_66,mi tio es insoportable,['distorsión'],['distorsión'],['distorsión'],['distorsión'],4
a_44,Se acercan las vacaciones es mejor que me ponga ya a organizarlas por si salen imprevistos,['no distorsión'],['no distorsión'],['no distorsión'],['no distorsión'],4
d_171,"Si estudiar no me hace feliz, es porque no es bueno para mí",['distorsión'],['distorsión'],['distorsión'],['distorsión'],4
a_134,"Que no me responda al mensaje sería algo incómodo para mí, pero llevadero",['no distorsión'],['no distorsión'],['no distorsión'],['no distorsión'],4
d_94,O está todo bien organizado o no voy a ir al viaje,['distorsión'],['distorsión'],['distorsión'],['distorsión'],4
a_136,"Si me deja mi mujer, pasaré una temporada muy dura, pero saldré adelante",['no distorsión'],['no distorsión'],['no distorsión'],['no distorsión'],4
a_139,"Si no me quiere, puedo encontrar otra persona con quien poder ser feliz",['no distorsión'],['no distorsión'],['no distorsión'],['no distorsión'],4
d_26,la gente del trabajo me odia,['distorsión'],['distorsión'],['distorsión'],['distorsión'],4
t_89,si no me dicen nada les escribiré yo,['no distorsión'],['no distorsión'],['no distorsión'],['no distorsión'],4
t_168,Siempre me esfuerzo aunque sienta que no vale la pensa esforzarse,['no distorsión'],['no distorsión'],['no distorsión'],['no distorsión'],4
a_1,A veces las cosas no salen como yo esperaba y esto me cuesta de asumir,['no distorsión'],['no distorsión'],['no distorsión'],['no distorsión'],4
a_30,"Tengo la sensación que me estoy implicando menos que antes, pero no puedo saber lo que piensan de mi si no les pregunto",['no distorsión'],['no distorsión'],['no distorsión'],['no distorsión'],4
d_182,Mi jefe me ha dicho que todos los pacientes a cargo de un residente deberían ser examinados por un médico de la plantilla. Seguro que jefe no se fía de mi trabajo.,['distorsión'],['no distorsión'],['distorsión'],['distorsión'],3
d_22,"Sé que mi padre, en el fondo, piensa que soy un inútil.",['distorsión'],['distorsión'],['distorsión'],['distorsión'],4
d_163,"Siento que soy una mala persona, por tanto debo serlo.",['distorsión'],['distorsión'],['distorsión'],['distorsión'],4
t_37,Estoy plenamente convencido de la inversión que voy a hacer.,['no distorsión'],['no distorsión'],['no distorsión'],['no distorsión'],4
t_56,Debo irme ya para llegar a tiempo a recoger a mi hijo a la escuela,['no distorsión'],['no distorsión'],['no distorsión'],['no distorsión'],4
t_41,debería comprar el pan para la cena,['no distorsión'],['no distorsión'],['distorsión'],['no distorsión'],3
t_31,Solo sé que no sé nada.,['no distorsión'],['no distorsión'],['distorsión'],['distorsión'],2
a_36,No puedo sacar conclusiones con la información que tengo ya que nunca me lo han dicho,['no distorsión'],['no distorsión'],['no distorsión'],['no distorsión'],4
d_68,la verdad es que no paro de pensar en que soy idiota,['distorsión'],['distorsión'],['distorsión'],['distorsión'],4
a_39,"No puedo saber lo que piensa, pero puedo fijarme en los hechos para saber si me quiere",['no distorsión'],['no distorsión'],['no distorsión'],['no distorsión'],4
t_165,"Siento, que no puedo con esto.  Pesa tanto que no puedo.",['no distorsión'],['distorsión'],['distorsión'],['distorsión'],3
d_14,constantemente estoy haciendo las cosas mal,['distorsión'],['distorsión'],['distorsión'],['distorsión'],4
t_129,Es insoportable la gente que habla en el cine,['no distorsión'],['distorsión'],['distorsión'],['distorsión'],3
a_192,"Que las cosas vayan mal, no tiene porque ser mi culpa",['no distorsión'],['no distorsión'],['no distorsión'],['no distorsión'],4
a_64,En ocasiones me equivoco y las cosas me salen mal,['no distorsión'],['no distorsión'],['no distorsión'],['no distorsión'],4
t_171,No me apetece hacer cambios en mi vida cuando me siento triste,['no distorsión'],['no distorsión'],['no distorsión'],['no distorsión'],4
a_6,Tengo la sensacion de que pocas veces me salen las cosas como espero,['no distorsión'],['no distorsión'],['no distorsión'],['no distorsión'],4
d_117,me va a ir mal con mi pareja,['distorsión'],['distorsión'],['distorsión'],['distorsión'],4
t_109,"estoy convencido de que será difícil, pero si me esfuerzo quizás lo consiga",['no distorsión'],['no distorsión'],['no distorsión'],['no distorsión'],4
a_199,"Cuando hacen referencia a que hay que mejorar el trabajo, no me lo dicen solo a mi",['no distorsión'],['no distorsión'],['no distorsión'],['no distorsión'],4
d_196,"Hemos ido de vacaciones y no ha parado de llover, es mi culpa debería haberlo comprobado antes.",['distorsión'],['distorsión'],['distorsión'],['distorsión'],4
t_167,"Estudiar no me hace feliz, y eso es molesto para mi",['no distorsión'],['no distorsión'],['no distorsión'],['no distorsión'],4
a_32,Creo que me odia,['no distorsión'],['distorsión'],['no distorsión'],['distorsión'],2
t_76,"Mi amigo es de Brasil, aunque hace dos años que vive en Barcelona y dice que le gusta mucho",['no distorsión'],['no distorsión'],['no distorsión'],['no distorsión'],4
d_170,"Esta persona me da mala espina, seguro que quiere hacerme daño",['distorsión'],['distorsión'],['distorsión'],['distorsión'],4
t_163,"Si me siento soy incompetente, tengo que trabajar de pie!",['no distorsión'],['distorsión'],['distorsión'],['distorsión'],3
d_156,Recibí una llamada del trabajo estando de vacaciones y me puse de mal humor durante todo el día,['distorsión'],['no distorsión'],['no distorsión'],['no distorsión'],3
