,text,pre_annotation,xavi,miriam,mireia,agreement
t_85,"si no tenemos arroz, cocinaremos pasta",['no distorsión'],['no distorsión'],['no distorsión'],['no distorsión'],4
d_136,"Si me deja mi mujer, será horrible, el fin, me moriré",['distorsión'],['distorsión'],['distorsión'],['distorsión'],4
t_104,me sentiré tranquilo cuando termine el proyecto,['no distorsión'],['no distorsión'],['no distorsión'],['no distorsión'],4
d_57,tengo que trabajar más,['distorsión'],['distorsión'],['distorsión'],['no distorsión'],3
t_105,"si no estudio, me sentiré inseguro",['no distorsión'],['no distorsión'],['distorsión'],['no distorsión'],3
d_105,"sé que no voy a aprobar el examen, aunque haya estudiado mucho",['distorsión'],['distorsión'],['distorsión'],['distorsión'],4
a_83,"A veces me equivoco, como todos, pero esto no me define como persona",['no distorsión'],['no distorsión'],['no distorsión'],['no distorsión'],4
t_33,Estoy seguro de mi mismo,['no distorsión'],['no distorsión'],['no distorsión'],['no distorsión'],4
a_191,"Si mi paciente ha empeorado, puede ser por muchos factores",['no distorsión'],['no distorsión'],['no distorsión'],['no distorsión'],4
t_132,Será algo duro y difícil,['no distorsión'],['no distorsión'],['distorsión'],['distorsión'],2
t_142,Los problemas de la vida son consecuencia de muchísimos factores,['no distorsión'],['no distorsión'],['no distorsión'],['no distorsión'],4
t_43,debo irme ya,['no distorsión'],['no distorsión'],['no distorsión'],['no distorsión'],4
t_100,Si soy feliz por cómo estoy aprendiendo a bailar me volveré una volveré bailarina profesional,['no distorsión'],['distorsión'],['distorsión'],['no distorsión'],2
a_129," Puede que me salga mal, pero lo he de intentar. De la experiencia se aprende",['no distorsión'],['no distorsión'],['no distorsión'],['no distorsión'],4
d_35,estoy seguro de que no le caigo bien aunque me diga que sí,['distorsión'],['distorsión'],['distorsión'],['distorsión'],4
a_90,Puedo controlar otros factores para no subir de peso,['no distorsión'],['no distorsión'],['no distorsión'],['no distorsión'],4
a_50,Me iria bien organizarme el tiempo para poder hacer lo que necesito,['no distorsión'],['no distorsión'],['no distorsión'],['no distorsión'],4
d_146,Mi madre está jugando con mi hermana pequeña. Creo que mi madre quiere más a mi hermana que a mí.,['distorsión'],['distorsión'],['distorsión'],['distorsión'],4
t_32,Sé hacer muy bien mi trabajo. ,['no distorsión'],['no distorsión'],['no distorsión'],['no distorsión'],4
d_75,"he tenido problemas con mi antiguo jefe, es una mala persona",['distorsión'],['distorsión'],['distorsión'],['distorsión'],4
a_86,"El problema con la familia de mi pareja me agobia, seria mejor que lo hablasemos y así podriamos encontrar un equilibrio entre nosotros y la familia",['no distorsión'],['no distorsión'],['no distorsión'],['no distorsión'],4
a_51,Puedo considerar otras opciones,['no distorsión'],['no distorsión'],['no distorsión'],['no distorsión'],4
t_106,"en la entrevista, sé que me evaluarán",['no distorsión'],['no distorsión'],['no distorsión'],['no distorsión'],4
a_91,"Todos necesitamos comer, puedo estar más atento al tipo de comida que como",['no distorsión'],['no distorsión'],['no distorsión'],['no distorsión'],4
a_3,Algunas veces hago las cosas de la misma forma,['no distorsión'],['no distorsión'],['no distorsión'],['no distorsión'],4
d_187,"Mis padres están teniendo una discusión en otro cuarto. Cuando pronuncian mi nombre, piesno que se están discutiendo por mi culpa.",['distorsión'],['distorsión'],['no distorsión'],['distorsión'],3
t_1,siempre me he sentido respaldado por mis amigos,['no distorsión'],['no distorsión'],['no distorsión'],['no distorsión'],4
t_199,Mis padres estan hablando de mi en otra habitación,['no distorsión'],['distorsión'],['distorsión'],['no distorsión'],2
t_182,"He estudiado mucho, no merecía suspender",['no distorsión'],['distorsión'],['no distorsión'],['distorsión'],2
t_86,si no encuntro un regalo le haré un vale.,['no distorsión'],['no distorsión'],['no distorsión'],['no distorsión'],4
a_119,"me lo pasé genial en otras fiestas, quizás en esta disfrute del momento también",['no distorsión'],['no distorsión'],['no distorsión'],['no distorsión'],4
d_63,Mi tío es estúpido,['distorsión'],['distorsión'],['distorsión'],['distorsión'],4
d_47,Debo sacar como sea adelante el curso.,['distorsión'],['no distorsión'],['no distorsión'],['distorsión'],2
a_183,"Aunque tengas la culpa de alguna cosa que haya sucedido, nada esta más lejos que pensar que eso se generaliza a todo",['no distorsión'],['no distorsión'],['no distorsión'],['no distorsión'],4
t_120,irá mal en ocasiones,['no distorsión'],['no distorsión'],['no distorsión'],['no distorsión'],4
t_77,Cuando me comparo con la gente de mi classe veo que soy bastante alto,['no distorsión'],['no distorsión'],['no distorsión'],['no distorsión'],4
a_37,a veces pienso que me odian,['no distorsión'],['no distorsión'],['no distorsión'],['no distorsión'],4
t_188,Seguro que no es mi culpa que ya no me hable más,['no distorsión'],['distorsión'],['distorsión'],['no distorsión'],2
t_51,tengo poca ropa,['no distorsión'],['no distorsión'],['no distorsión'],['no distorsión'],4
d_130,"Si mañana no me sale bien el examen será horroroso, yo me muero",['distorsión'],['distorsión'],['distorsión'],['distorsión'],4
d_143,"Pude haber disfrutado de la excursión a no ser por el pollo, que estaba quemado.",['distorsión'],['distorsión'],['no distorsión'],['distorsión'],3
a_175,"Me siento mal, pero puede que sea porque el resultado ha sido negativo, aunque en realidad no haya hecho nada malo",['no distorsión'],['no distorsión'],['no distorsión'],['no distorsión'],4
t_53,"Tengo que ir a ver a mi madre hoy, es su cumpleaños",['no distorsión'],['no distorsión'],['no distorsión'],['no distorsión'],4
t_28,Se que la leche me sienta mal,['no distorsión'],['no distorsión'],['no distorsión'],['no distorsión'],4
t_8,Siempre me levanto temprano,['no distorsión'],['no distorsión'],['no distorsión'],['no distorsión'],4
